Date ,Rate ,Topic ,Review ,Type 2018/07,5,"The museum itself is a 4, but free admission on Sundays makes it a 5!","We were in Providence one afternoon (checking Rhode Island off on my states-visited list) and needed something to do. We had taken a red-eye from the West Coast to Boston the previous night and so didn't want anything too strenuous. We all enjoy museums and found out that admission to the RISD museum is free on Sundays! And it is located next to Brown University, whose campus our 16-year old son wanted to see.

The museum has a small but impressive collection of Asian artifacts (including a Japanese palanquin and huge Buddha statue), contemporary art, fashion and furniture (think Frank Lloyd Wright, Alvar Aalto, Diane von Furstenberg, Pollock, and Calder), Egyptian artifacts (including a sarcophagus and mummy), an impressive textile collection, and other European and American art. We greatly enjoyed wandering around to see and read about everything.

There is also a nice coffee shop by the north entrance with indoor and outdoor seating, and a gift shop featuring works by former RISD students by the south entrance. And did I mention that admission is free on Sundays?!! A must see if you're in town on the seventh (or first) day of the week, only a 5 or 10 minute walk from the train station!",Family
2017/10,5,A must see!,"Tucked away right by the river on College Hill, I had passed by so many times without even knowing it was there. Its amazing how a rather large museum can fit in such a small area. The staff are very friendly and the art itself is mesmerizing. Highly recommend it.",Friends
2018/06,5,Interesting Exhibits!,"Very nice exhibit on liberty and the nature of such from various perspectives. Wide variety of media and artistic backgrounds interestingly curated. Also visited another gallery in the museum with a variety of 20th century art and design works-furniture, textiles, mechanisms, etc. Always impressed to see a Picasso in person!",couple
2018/06,5,Good art gallery for a second tier coty,This gallery is worth a visit. Good collection of all types of art over six floors. Considerably above my expectations for a smaller city. Back entrance is on Federal Street which is itself magnificent (the 10am walking tour is really really good -certainly if Scott is the guide). Particularly liked the papal Gay Pride curtain for the month that was in it.,solo
2018/07,5,Interesting site,"Very nice museum. Lots of interesting art to see and if you go on Thursday evenings or Sundays, it is free of charge.",couple
2018/05,5,Do not miss it when you are in Providence!,"What a wonderful surprise - eclectic collection from Contemporary Art to Dutch Masters to Egyptian artifacts - there really is something for everyone at the RISD Museum of Art. Those with a keen interest in art and historical artifacts will find it fascinating. Don't forget to explore Pendleton House, which has an incredible collection of American decorative art set up within the context of a period home.

The museum is fairly compact across multiple floors organized by theme. Although we were given a map and there are signs, I found the complex floor plans a little bit difficult to navigate. All of the staff were very friendly and approachable, and did their best to help us get around.

It is fully accessible, and although there is no parking on site, street parking is available nearby - we were there during the week, so parking was a bit limited, but we still managed to find a spot - not sure what it would be like on the weekend.",Couple 
2017/10,5,Amazing museum,"We were at the RISD Museum last October, and it ended up being one of the highlights of our New England tour. It is large enough to have a wide range of exhibits, and yet it is not overwhelming. The exhibits were well laid-out and the information about different pieces was excellent. As an amateur furniture maker (very amateur) I was thrilled to see examples of cabinetmaking by guys like Goddard and Townshend, whose pieces name command millions at auction.",couple
2018/06,3,Interesting museum with a bit of everything,"The primary reason I didn't give it more stars was because the section we started in contained many negative sentiments. Rather than making me think about the message they were trying to convey, there was so much negativity that it just really brought me down. It was hard for me to shake it. Granted, this was how the artists were feeling, but there is enough positive in the world that some of it could have been included in the displays. I loved the Egyptian, Greek, and Asian displays. The European Galleries included paintings by Cézanne, Degas, Manet, Matisse, Monet, Morisot, Picasso, and Van Gogh, which I also enjoyed. Non-flash photography is allowed. The cost per adult was $15, which I thought was a bit steep.",Family
2018/07,5,As good as a European museum,"This museum is outstanding. It’s a nice size and has some great art (Van Gogh, Renoir, Monet to name a few - seriously) plus Asian, Egyptian, Frank Lloyd Wright, special exhibits and a nice cafe. You won’t regret visiting.",Friends
2018/06,5,Something for all art lovers,"A wide range collection from antiquities to
contemporary art nicely displayed thru 5 buildings
We were told a good way to view was to go to top and work your way down— worked for us",
2018/06,4,A little bit of everything,"This is a great rainy day activity. There was a little bit of everything-ancient Chinese, Ancient Greek and Roman art, Egyptian, the classics, Impressionist and Modern and Contemporary. It left me wanting more. I’m not always a museum person, but I really enjoyed this.",Friends
2018/06,3,Interesting art,Went in for souvenirs and stayed for your different St work and interesting presentation you must like modern art to appreciate this place,
2018/06,5,"Huge diversity of art, as appropriate for an Art School!","There is a huge selection of art in the RISD Museum, from the classics to the cutting edge artists we've never heard of. They have fine European masters and art from South America, Africa and Asia. It is such a large museum, they don't really seem to compete for space, one just moves from one genre to another. The one secret is that you MUST save lots of time for the Museum store. They have so ma",Family
2018/07,5,Many Diverse types of art & Sundays are Free!,"Worth the visit, the Impressionist Art and Modern art displayed are some I've never seen. Getting around to specific departments is confusing and a lot of stairs, had to walk through the entire museum again when leaving. Student show was disappointing, I have seen much more creative and tasteful.",Couple
2017/07,5,Small museum with consistently excellent shows,"I have never taken anyone here who did not like this museum.
Small museum, excellent layout, warm staff.",couple
2018/05,5,Brilliant museum,Wonderful Museum which I would highly recommend.It is a great highlight of Providence which has really improved over the past 10 years.,
2018/05,4,What a marvelous museum!,"“My husband and I decided to stop in Providence and visit The RISD museum on our way to Narragansett. So glad we did. This museum has something for everyone and house much more than I expected. the Phantom of Liberty Contemporary Works exhibit included photos, prints and drawings that were very thought provoking. Do take the time to read the information next to the works because it is quite important for the understanding of the works. One must see this exhibit and form his/her own opinion of these incredible works. Beyond that, we also enjoyed the other permanent collections. There was an excellent historical American area with colonial rooms in beautiful furnishings. An ancient area had Greek, Egyptian and Roman works. In the European section we were surprised at the size of the Impressionist art. Costumes and Textiles were also well represented. This museum is truly worth seeing and you need to allow a good amount of time for exploring!”
",Couple 
2017/06,5,Outstanding!,"We are lucky to have RISD in RI! Such a spectacular museum you could spend hours in. It is a RI gem for sure. Go! Take you family, Friends and children. On Sundays it is free admission to the public! RISD will not disappoint!",Family
2018/05,5,Artists are grown here,"Think you’ve seen unusual, wacky, cutting-edge art? Come here and check out where it probably came from. Cozy campus straddles genteel Benefit Street and downtown. Great museum, fun store!",Family
2018/05,,Worth a visit,"My wife and I visited here to fill some time on an iffy weather day. The collector impressionist art made the stop well worthwhile. Additionally, there is a collection of a wealthy Providence resident that is housed in a replica of his original home. The collection includes his artwork, furnishings and other collectibles.

Our only disappointment was the exhibit of student art. The museum is part of the RISD (Rhode Island School of Design). If the presentation of “art” that we we observed is representative of the future of these artists, the school should shut down.",couple
2018/05,5,Great museum,"This is a very interesting museum with much to see. It's a little difficult to figure out where you are at times but the security guards are extremely helpful with guidance. There are several buildings tied together to form the museum so it can be tricky, but it is fun! Easy to go through and then make a trek through the Brown University campus.",couple
2018/04,4,Worth a Visit,This is a delightful museum with a variety of artworks ranging from classic (old) to contemporary to student art spread over several floors. Don't miss the huge wooden Buddha (in a room of its own in the Asian art area) or the little Jackson Pollack tucked behind a pillar in the modern art room. Well worth a visit.,couple
2018/02,5,One of the best art museums in New England,"RISD museum is excellent - a historic Providence house with some original decor, and a huge historic / modern art museum attached. Don't miss the big inner gallery with huge paintings and portraits; there are some amazing things there.",Couple
2018/04,5,BEST MUSEUM!!!,"I've been to museums all over the world, and this is truly my FAVORITE!!! They have an Egyptian mummy, Monet, Manet, Degas, Rodin, Warhol, a lion from Babylon.... etc., etc., etc. What's amazing is that they have a little bit of everything, and can be done in ONE visit!",Family
2018/04,4,You get easily lost - but nice collection,"It is a quite big museum - and you can get easily lost, because I think the signage is quite strange, or maybe not enough maps. Also it is a bit disorganized and there is no real connection between the different galleries, mixing eras and geographic zones.
But I appreciated the fact there was not only paintings but also sculpture and antic objects. The quality was overall very good.
Tip: Go there on Sunday because the entrance is free. Indeed even if I liked the museum I think the general price is quite expensive, compared to similar museums I have recently visited.",Friends
2018/02,5,Loved it,"Did not realize how many artifacts of historical relevance, it was really a treat. I thought it would only be art but I was mistaken",Family
2018/04,5,Excellent!!,We toured the museum and there is a wealth to see. Includes many many different art forms. Be sure to see the painting gallery for the Van Gogh!,couple
2018/04,4,Beautiful water line for a ealk,If you expect a review on its programs you can stop reading. This is about the campus and how beautiful and relaxing it is to enjoy a walk along the water line - park at 1 century plaza - get a coffee or something else and take a walk - beautiful,couple
2018/04,5,A gem!!!,RISD museum is truly a gem tucked away on the historic East Side. The exhibits are extensive yet small enough not to be overwhelming. It's a very peaceful place and the cafe is excellent too. Sundays the admission is free! Absolutely worth a visit.,Friends
2018/04,5,Prospective student,"“We visited RISD and participated in the prospective student info session and tour.
Staff was very informative and students were very helpful. The tour was about 1 1/2 hours long, touring dorms, the Met, library,
Nature Lab and illustration building. The student guides were respectful, informative and very friendly. The campus is clustered which makes for good student access. The fact that Brown offers many of their facilities to RISD students is awesome. We learned a lot and left with a threat impression of the programs and campus.”
",Family
2018/04,4,New Exhibits all the time,"Graduation season for Brown Univ., RISD., and Johnson and Wales University. All within walking distance to this great museum. A must see if Providence is on your to go list. A special treat for young and old as welll is the very popular “mummy”",
2018/03,5,"If I could give a 7 for rating, I would! Delightful!","RISD Museum continues to be top-notch! we were there Jan 2015 and much of the displays delighted me-again, or newly! Beautiful furniture design-a cherry music stand as eye-catching as a sculpture--some classics from mid-century 1900's still sharp and stand-out well-designed---but I also want to compliment the guides this time. We were given suggestions and offered assistance to see more of what we were obviously enjoying by several guides-and helped navigating some of the more confusing halls and connections between areas. All was done pleasantly and so helpfully-I was really impressed and grateful!",couple
2018/04,2,Not welcomed,"I like visiting art museums but my experience here is far from satisfactory. The museum itself is very small and exhibits are limited. But this is not fatal. The security guards were unfriendly and tried to stalk visitors as if they had a plan to steal the collections. This scares off many people, including us. The management should face this issue seriously.",Family
2017/10,5,The Little museum that could,The RISD museum is small compared to big city behemoths but it packs a big punch. It has a great ancient art collection and a number of interesting Impressionist pieces. There are a number of works by female artists. Great modern fashion and furniture collection.,Friends
2018/03,5,A Wonderful Museum,"I visited this museum on a Sunday and to my delight, it's actually free admission every Sunday. The museum is operated by the Design University and therefore some of the exhibits on display featured facility artwork which was different and unique to this museum. From the outside the museum doesn't look that big but it actually has 3.5 full floors dedicated to different works of art including a house which was built for the sole purpose of displaying furniture from the 1800s & 1900s. The museum features a little bit of everything including some new modern art with interesting concepts. It's a good way to spent anything from a couple of hours to an afternoon of your time depending on your interests. I would definitely recommend visiting this museum!",Solo
2018/03,5,Fantastic art,This place is incredible with all the works of art. Pieces from all over the world and local as well. Be sure to spend at least 2 hours to really enjoy the history here.,couple
2018/03,5,Wonderful Visit!,What a jewel! Happened upon this museum and was blown away at their permanent collection and the student /faculty exhibition. Lots of great energy!!,
2017/10,5,"Edgy art, creates inspired conversation with family","Edgy, would like more interactive art for the kids to indulge in, a few exhibits were creepyish but nothing we couldn’t laugh about. Will always frequent the RISD museum, loyalty for life.",Family
2018/03,5,a don't miss museum,"the RISD museum is a collection of interconnected buildings, culminating in an impressive new structure facing south main street. there is a wonderful coffee shop on the upper benefit street entrance side. the staff are particularly friendly and helpful. the permanent collection is small but impressive, and the changing exhibits are the reason to go. Great little gift shop as well.",couple
2017/07,4,An under appreciated art museum,A small museum but with an unexpectedly good collection. Mainly a teaching museum with examples from major artists and schools. The collection is primarily American art but with a few European masters. It includes newer examples from RISD faculty and grads (including Chihuly),
2017/11,5,One of best small museums in the country.,Well curated by Rhode Island school of design the museum has fine collections of art representative of all periods. Easy to add to schedule while visiting providence. Has a nice cafe and the museum guards are very knowledgable - many are artists who do this job as support for their own art.,Family
2018/02,5,"Art class at RISD

",Took a weekend class on techniques for painting Acrylic paints. Had a great time and it was inspiring. Highly recommended.,solo
2018/02,5,Wonderful museum,Their design collection is impressive. I didn’t expect to find high quality old master paintings and sculpture here.,Family
2018/02,5,"First visit, hope to visit again.","My sister and I visited this museum on a Sunday. What a lovely museum.
First off it was free on this particular Sunday.
They have a large, well curated collection. They even have a mummy!
We also attended a free concert given by a local group that teaches music to children in Providence. It was great, a really wonderful concert of various pieces for strings.
The building is very nice also.
Street parking to be found if you’re patient and can walk a bit. Area is steep and hilly.",Friends
2018/02,5,Great museum,"It’s the RISD museum. Despite its size, it has an impressive, well-curated collection. Well worth the visit. On Sundays it’s free!",Friends
2018/02,5,“Sunday’s no charge”,Since there was no charge on Sunday we decided to explore the RISD Museum. We were pleasantly surprised what a great museum this is. It’s sort of eclectic mix of new and old. The old section is like a house from the 1800’s filled with old paintings. We saw a Gilbert Stuart if George Washington along with many great furnishings of that period. We also saw a Renoir a Pollock along with student exhibits. It’s so large that after a couple of hours we agreed we’ll visit again. Such a great take with a nice cafe at the end. If you do visit parking even on Sunday can be a challenge.,couple
2018/02,4,Mirabile Dictu,"Both the variety and quality of artifacts on display a true the RISD museum of art make it a museum I wouldn’t like to visit on multiple occasions. The Asian collection, in particular, stands out for its Korean porcelains and Hindu imagery. Too, the Egyptian artifacts really sparkle with their superbly maintained colors and intricacy of hieroglyphs. Perhaps the standout items, though, are a massive wooden Buddha and a carved mantelpiece, both of which balanced delicacy and scale.",couple
2017/04,5,Small Choice Museum,The RISDI Museum is very special. The collection is highly varied and excellent and both the old and new sections of the Museum do justice to the art on display. Locals come again and again.,couple
2018/01,5,Great variety and free.,"The current exhibit on pen drawings included works by Rembrandt, Michaelangelo, Da Vinci, Picasso, Duhrer, Hockney,. I love how there simple lines evokes such life like images. The museum has quite a breadth of periods, form roman to modern. There are Gilbert Stuarts, furniture forom 1700's, porcelain figurines, ... Expect to spend the day there. Sunday is ideal as it is open to the public for $0.. Other days, show your Bank of America card for discount.",
2019/01,5,Wow,OK we had low expectations - Providence Museum experience at RISD. This place really blew us away. Great experience!,
2017/12,5,Neat special exhibit,The museum itself is wonderful. A hidden gem of Providence (see the wonderful Rotho). But current special exhibit which traces the various roles of drawing over the ages is also well worth seeing Since last July there is also a Bolt Coffee cafe with light food at the Benefit Street entrance- a nice place to relax,couple
2017/12,5,WOW,"I was just looking for an activity to escape the snow and I did not expect to find such a wonderful museum. They have a nice collection and the current ‘Drawing’ exhibit was amazing. They also had a nice cafe that provided a nice, warm pick me up about half way through.",solo
2017/08,5,Stunning museum,Such a vast museum with such an interesting array of exhibitions. I very much recommend a visit here.,solo
2017/11,5,A stop whenever I am in Providence,"This is a gem of a museum. The art they have is wonderful and new exhibits are
always curated beautifully.
Make sure that you stop by.",Family
2017/12,5,Bday trip to Providence,"Don't miss this great museum. We were lucky to catch a special exhibit from Great Britain. Saw drawings by masters including da Vinci, Picasso, Rembrandt, Rubens, Vicor Hugo, Michael Landy, etc etc Also saw some of regular exhibits, some from Rockefeller. Saw Renoir, VanGogh, etc etc Gorgeous Asian drawings by Kunisada.
Ate tasty bite for lunch at cafe in museum. The bread was just incredible! Very filling yet not gigantic so you could later indulge at dinner.
Highly recommended. Got there 1st Saturday and was able to enjoy discounted entry, too!",couple
2017/08,5,Very good museum,"A must-do for art lovers and beyond. A lot of variety, including furniture and other non-traditional media.",
2016/12,4,Lots to see,"Great museum, was here many years ago on a school trip, and there was just so much to see and take in . Would come here again with out a doubt !",Friends 
2017/11,5,Rhode Island School of Design Museum of Art,"This is a must see and do place if visiting the Providence, RI area. We went there after reading the reviews and were not disappointed. I love the exhibits, art galleries, student gallery display and all the people were so polite and answered all of our questions. If you like art, then please spend a few hours and see all the paintings and art work that is displayed over the last few centuries. WOW !!!!!!!!",couple
2016/11,5,Well worth a visit,"The museum has many unique exhibits. An Egyptian mummy, a Buddha and many others. It’s a hidden gem near Brown University.",Family
2017/10,5,Wow!,"I had no idea of the scope of well known artists & periods.I was blown away-not expecting!Saw Monet,Manet,Degas,Warhol etc etc!!Definitely need to return!",Family
2017/11,5,Very eclectic collection of art,"We went to RISD on the recommendation of our gondalier. Several floors of art exhibits - furniture, textiles, sculpture, porcelein, ancient aritifacts and art, and paintings. Well worth the admission price",
2017/10,4,Impressive museum,"The museum is larger than we expected, and quite sprawling. We spent a good 3 hours wandering through the exhibits, which were varied--everything from furniture to impressionist painters, to ancient Greek urns to minimalist art.",couple
2016/10,4,Surprisingly lots of interesting exhibits,"We made it up the hill (several times thanks to metered parking time limits) to visit this lovely museum courtesy of the Bank of America monthly museums on us perk. Surprisingly one of my Friends was also able to snag a free ticket for her SO even though he did not have a BoA card. I was not expecting much from this museum in terms of size and variety since it's part of RISD campus, but there are countless interesting works of art. I even felt tired during a portion of walking around that I retreated to the seating area where they were playing some of their student film creations on the lower level.

I think one of our favorite pieces was the 3D painting which is basically created with several hundreds of layers stacked on top of each other and the chrome almost makes it look like a mountain of paper clips. They also have some ancient art work and coins in one of the other rooms which is always fascinating to read about.

One of the parts that I'm confused about was the parking since on the website it sounded like visitors are able to use the staff parking since they're obviously not working, but it wasn't really clearly labeled. We didn't want to risk a ticket so we just found a metered spot a few streets down slightly lower on the hill.",Friends
2017/10,5,Always Great,"It's been four years since my last visit and as always great to go back here. Should be a ""must"" on any visit to Providence. There are 6 levels, that include Modern & Contemporary, European, Egyptian, Decorative Arts & Design, 18th & 19th Century American. They also have a cafe offering drinks and delicious eats.",Friends
