Date ,Rate ,Topic ,Review ,Type 2017/05,5,Amazing variety of art,"I was so blown away by the incredible amount of art in this little museum! I didn't expect there to be so many floors, and sections. I especially loved the Egyptian and Asian sections, as well as the section on Impressionism.

The fact that it's free on Sunday was an especially fantastic bonus! If you're planning a visit try to make it on a Sunday!",couple
2017/05,5,Wonderful collection and setting,"We had no idea what a remarkable museum this is - the architecture, the collections, the intimacy of the galleries, it all was a pleasant surprise. Definitely should be a ""must see"" when visiting Providence. And don't rush - plan to stay for a few hours.",couple
2017/05,5,A Jewel of a Museum,"Sunday is ""free"" day at the RISD Museum, so it was perhaps more crowded than on a pay day, but we never felt crowded. The Benefit Street entrance leads into an early-19th century house, with many rooms of antique furniture and accessories. The North Main Street side has more contemporary art, but also Ancient Egyptian, Greek, and Roman artifacts.",couple
2017/05,5,"Beautiful rotating displays of original art by RISD students, as well as classics from the masters...","Check out this gem in the heart of Providence, and make sure to take a peek during their monthly free days Admission is free every Sunday (10 am–5 pm) and on the third Thursday evening of each month (5–9 pm).",
2017/05,4,AMazeIng,"Took the advice of our fellow TA'S and with a raining weekend at hand explored the museum. The exhibits were well done and very interesting from glass to furniture to Impressionists to sculptures to mummies to Chuhuly to Greeks/Romans. The Cafe Pearl was small but the light lunches/snacks/beverages were delicious. Be aware they are under renovation and you must walk back and forth across the museum to get elevators to get to exhibits-- but amid the maze, it is well worth while.",Couple
2017/05,5,Inspiring.,Always enjoy seeing the work of designer disciplines! Has a great vibe. Spread out in the city. Close to Brown. Museum impressive.,Family
2017/05,5,RI's best kept secret of an Art Museum.,So many wonderful exhibits and so many locations throughout the Museum. Perfect anytime. Outstanding collection for a small local Art Museum. Worth gold as far as I am concerned.,couple
2017/04,5,Incredible collection,What a surprise to find such masterpieces in a college museum. We visited during renovations but found a huge collection of works in a large room with a string quartet playing and artists painting and sketching. Beautiful example of a working museum.,couple
2017/05,5,good family activity,They often have family museum tours and art classes on the weekend. It is a great place for families with children from about age 4 and up. They also have wonderful exhibits in the museum for all ages.,
2017/04,5,always something new,We enjoyed the current Impressionist exhibit as well as the costume / fabric collection.. The attached historic home is very interesting.,couple
2017/04,5,A Museum that is fun!,"Nicely done museum, A little bit of everything. Impression paintings to dress design... even my husband enjoyed it. Nice coffee bar lunch area, reasonably priced. Sunday is free admission. Easy walk from most hotels. Would recommend to any traveler, even with kids.",Friends
2017/04,3,"A museum you can cover in one day

","The interior of the museum was confusing and some of the exhibits were haphazardly displayed. The gift shop had the normal array of jewelry, books & art in difference mediums. Some of the RISD t-shirts were artful & funny.",Family
2017/02,5,Providence is a very walkable city and this museum should be on your path.,"This is a great stop while also touring other city attractions and has something for everyone. The museum's collection is eclectic covering time from ancient to modern. I was fascinated by multi-media creations by RISD students. How far we have come from pencil on sketch pad!
Two other favorites were Intermission display of European objects and paintings that included a sculpture of the Monument to Balzac by Auguste Rodin and glass chandelier by Chihuly. If you must arrive by car, there is validated parking within one block.
The museum was under construction/renovation during my visit so it was a little disorienting to move from floor to floor but staff are wonderfully helpful.",Solo
2017/04,5,Well Edited Collection,"This museum was a wonderful surprise. An impressive and well curated collection in which to spend an hour or so. Interesting gallery spaces, welcoming staff at the front desk, and a vibrant store adds to the experience. Will stop in again when I am in Providence.",couple
2017/04,4,Wonderful maze of history,"The maze of the lay out reminds me of the streets in Boston. But I actually like that it makes it more fun to explore.
The people working there are really helpful. They do not mind any and all questions.
The different sections are laid out for easy viewing.
I am not a big fan of museums but though it is small, it covers quite a bit of history.
I would recommend a visit.",couple
2017/04,5,Didn't know what to expect,"RSID museum has a wonderful collection of art from all over the world. The museum is assembled at a human scale, just enough of each type of art to get your interest.",couple
2017/04,5,Impressionists Exibition -- Inventing Impressionism,"Manet, Monet, Renoir, Cassatt, Degas, Gaugin, Cezanne, Morisot. These artists' works are always a delight. We also toured the rest of the museum, but the impressionists were what we went there to see. Splendid works.",Friends
2017/04,5,"lovely visit, manageable yet representative","“- a small museum which makes it manageable and not overwhelming, yet contains beautiful representative pieces...
Good break from seeing RSDI or Brown campus.”
",couple
2017/04,4,"Difficult to navigate, but worth exploring","You would think a School of Design could provide a decent map of its collections, but the one I got here was useless! I ended up wandering aimlessly through the galleries, which led to several great discoveries, not least a historic home with remarkable Rhode Island furnishings. Given renovation work, European painting and sculpture are crowded into a single room with no labels or guide. But there are interesting selections of ancient Egyptian, Asian, and Western decorative arts, apart from the historic home, which is a must-see. All in all, this is worth a visit, though I'd encourage the Museum to provide better guidance to visitors, both on the website and in the printed materials offered on site.",Solo
2017/04,5,One of the highlights of Providence,Wonderful museum with a wide range of exhibits. We spent 2 hours here and it was a great experience. Definitely a must-see if you're in Providence.,couple
2016/05,5,Bigger and better than I expected!,"That's what she said. Really, though, I expected a small college museum with a few rooms and ended up with a whole afternoon worth of exploring both traditional and modern works. Nicely curated, and free on Sundays. I plan on going back!",couple
2017/04,4,Bit of a maze but some excellent art,It's a bit confusing to navigate but elevators and friendly security guards were able to direct us to all parts of the museum. I most e joyed the Impressionists and fine sculptures. The museum is being updated but during renovations still excellent. The coffee shop is good too including the young lady who sculpted a fine foam pattern on our coffee and hot chocolate.,Family
2016/07,5,RISDMuseum & Store/Gift Shop,Great Art. Wonderful Bldg. & huge in size. I don't think one can appreciate the whole Bldg. in 1 visit. There is just too much to see. Open Late on Thursdays until 9pm. I love this place & I can't wait to visit again. Don't forget to visit the Gift Shop & buy some of the Artists Work before they become famous!,
2017/04,4,Explore,Great stuff - extensive refurb on a number of floors so flow hampered slightly but some interesting and surprising stuff,Family
2017/03,4,Very good college museum with a wide ranging collection.,"First a little caution: the museum is undergoing some renovations and so parts of the collection are unavailable now and there is some confusion in getting around, since a couple of areas are shut off blocking easy access. Nevertheless, the museum holds a very interesting range of art and design from ancient to contemporary, from American and European to Asian. Surprisingly good selection of Egyptian and Greek and Roman art. Also, ancient and some more modern Chinese, Japanese, and Indian. 18th, 19, 20th century American and European works in every medium; then of course there are many items relevant to their mission to teach design. And there are students everywhere, sketching but not so as to be in the way of other patrons. We frequently remarked about how lucky these students are to have such a treasure trove as a part of their college experience.",Couple
2017/03,5,Don't miss this museum!,They have everything -it's a delight to wander through the beautifully and interestingly curated space.,couple
2017/03,5,Great Afternoon...and Free!,"Would have liked to have stayed longer, but we arrived late in the afternoon.
Much to see and enjoy from the 18th and 19th century paintings to the Greek and Roman antiquities. And it was all free! (on a Sunday)",Family
2017/03,3,"Though Small, RISD Museum of Art Rises to Meet Expectations","I've lived in walking proximity of the museum for a year and a half, and had never been in until today! I don't know what took me so long to visit this small, but great musuem.

Home to one of the largest Buddah statues in America, this attraction houses many awe inspiring artifacts, such as expertly crafted sarcophagi, ornately painted cartonnage cases that were used to house mummies, and coins from anciant Rome, to name a few.

As someone who doesn't neccessarily lable herself an art enthusiast, I appreciate this museum, because it displays pieces that represent something more tangible to me, rather than showcasing only paintings, which I often seem to lack the emotional response or understanding that is evoked for many people.

When you are in Providence, I highly reccomend paying a visit to this museum, especially on sunday, as it is free admission. Enjoy!",Solo
2017/03,5,A small museum with many gems,"“A delightful museum with a much larger collection than expected. It has a peculiar layout, combining perhaps three buildings, so that in order to exit the way we came in, we had to go up to the 4th floor and then down another elevator. Very enjoyable.”
",
2016/12,5,Great local museum,Its amazing that most of the people that go to this museum are from out of the state visitors. Such a great museum that even local Rhode Islanders do not know about. It has a little of everything and the place is deceiving from the outside as the how big it is after you enter. The help in the museum are so very kind and helpful and will direct you to what you may be most interested in. The place is never crowded and has a nice quietness about it. Great place to roam around in.,
2017/03,3,A Little of a Lot,"The museum has a little of a lot of styles of art. When we visited, it was undergoing renovation. Some floors were closed and it was a bit confusing to find our way around.",couple
2017/03,5,Intimate museum with amazing pieces of art,"My first visit to the RISD Museum really impressed me! The quality of the art was amazing for a small museum. The small rooms and the uncrowded atmosphere also made for a wonderful, relaxed visit.",Friends
2016/12,5,Wide Interests? No Problem!,"This museum offers such a variety of art and design from so many eras that there is bound to be something that appeals to everyone. I loved looking at sculpture, clothing, the old masters and modern furniture design then finding ourselves in a historic house. There are permanent and temporary exhibits so there is always something new when you go. I've been a few times on my own but recently got the chance to go with three generations of my family. What a great time we had! It's great that it's free on Sundays too!",
2017/03,5,Perfect size museum for families,The RISD museum has something for everyone. I was a particular fan of the decorative arts including the Chilhully chandelier and arts and crafts vases. The kids loved the colonial rooms and costumes.,Family
2017/02,4,A must see! Did not expect such a great variety,"Lovely museum, its small size belies what a cornucopia of art treasures I saw here. Didn't expect so many greats. Everything from sublime Buddhist pieces (including one of the largest Buddha statues) to cool, Swedish minimalist furniture ....to textile and fashion pieces ...famous paintings by cezanne, monet, Renoir. All lovingly assembled, but not too overwhelming nor too many that they would wear me out. Cherry on top: it's FREE ON SUNDAYS! Don't miss this.",
2017/02,5,Full of Gems,"Whenever I'm in town, I check to see what the special exhibits are first...but often just wander among the permanent collection since it is full of unexpected treasures.",Friends
2017/02,5,Amazing Artwork,"We never expected to see such a wide variety of art in a college museum. From Egyptian to Roman to classical to contemporary, the Rhode Island School of Design Museum of Art had it all. The only thing missing was student artwork which was in the process of being set up. Friendly and informative staff. One negative is the lack of a parking garage but if you're lucky you'll find a spot on the street.",
2017/02,5,Never disappoints,"Please make a stop here you won't be disappointed! One of my favorite spots to go, mostly for the stories from the staff about the pieces they have. One of my favorites is about the owner of house walk through. They replicated a man's house I don't want to spoil anything just ask when you enter what the deal is with him! The pieces don't really change much in most of the exhibits but the tidbits of info I learn are always new and exciting! The staff are always welcoming and really want to tell you all about their section so please I encourage you ask!",Friends
2017/01,5,Relatively small museum with a diversity of a big one," If design is an attractive issue for you, and you also like to see it in a historical perspective as well as in a global scale, you'll probably spend good time here. With various objects from Asia and Europe, a rich collection of post colonial US and a modest but striking section on contemporary art are all together inspiring. And the museum shop has really original pieces.",Family
2016/06,5,A homecoming of sorts,"I was fortunate to go to RISD back in the 1980's, while I was in school going to the museum was a perk. Now it's a treat, to go back, to see new acquisitions and shows. This is one of The MUST - go to places on a visitation list! To pass this by would be a cultural loss for everyone in your family, every religion, every mind 'could opened' just a little bit more.",couple
2017/01,4,A good museum,"This museum is not big, but it has some interesting exhibits. I like the sculptures and furniture exhibited in the museum, some of which are the work of RISD alums.",
2017/01,5,"First time visit, but not the last, particularly of free Sunday's","The RISD Museum was always on my must see places to visit where it is only a 20 min., less than 14 mile drive from my home. The free Sundays from 10 am - 5 pm and free on street parking which can be a problem on Providence's College Hill anytime of the day or evening, plus a local group organizing a Meetup to see the ""Inventing Impressionists"" exhibit got me off my butt to final go. I was blown away by all the exhibits and galleries and will be back again when I have a free Sunday. One suggestion is to buy the hard bound ""Selected Works"" book in the Chase Lobby gift shop (a bargain at $10) which is cheaper than an adult entrance during regular visiting hours. It will help you learn about many of the artworks on display in the Chase Gallery that do not have tag plates.",Friends
2016/07,5,Good night out,The free Thursday exhibits are fantastic and a great free night. The exhibits are as wonderful as any art museum!,
2017/01,4,Nice museum,The RISD museum was being renovated so was a bit difficult to maneuver around. The displays were interesting and worth the visit. We enjoyed our time there.,couple
2016/09,5,So much to look at!,"This museum was a great surprise! There were so many different exhibits covering ancient through contemporary art. Make sure you allow yourself enough time, you won't want to be rushed.",couple
2016/03,5,An Artist Gem in Providence RI,"Come for the classical artwork, stay for the history. This art museum has a bountiful collection of ancient and modern art. It has a 13 foot wooden Buddha the has awed children of all ages for years. it is an absolute must for lovers of art. And a pretty nifty gift shop to boot!",couple
2016/02,5,An artistic gem in Providence,I love the mixture of ancient art and contemporary exhibits. Eclectic and full of exciting art. I highly recommend it!,couple
2016/11,5,"Full of surprises, and an easy way to spend 2 enlightening hours.","This is one of my favorite places in Providence. I am sure people would be surprised to see that this little museum has a little bit of everything that you would otherwise have to travel the world to see. Mummies, a large Buddha, Picasso, an alter, various contemporary artists, Fashion, furniture, Colonial furniture, silver and tea sets, Greek statues and jewelry.... every corner surprises!",couple
2016/11,5,Great activity on a rainy Sunday!,"We visited the museum on a Sunday early afternoon, and it is a wonderful place! Lots of interesting exhibits, both artwork and sculpture, modern and not. Was not very busy, either. We didn't know this, but it is free every Sunday from 10 to 5. That was the icing on the cake!",Friends
2016/07,5,Beautiful museum,"Excellent collection of art from masters and from the students of RISD. We were able to see a special exhibition that was spectacular. There are free exhibition days so be sure to check ahead, I believe in Sunday's.",couple
2016/07,5,This small gemstone of a museum is a great place to visit in Providence.,It is nestled into adjoining brownstones at the foot of College Hill and has a midsized collection spanning from the ancient to the modern era. Many major artists are represented. I love this little place!,couple
2016/11,5,small but high quality,"Been there twice, has modern art, paintings, antiques and furniture. compare with the size, they are really high quality collections. Museum itself also well designed, glass corridor connected two old buildings. Sunday free.",Friends
2016/11,5,Great art and design museum,"This is a very interesting museum of art and design. Quite an eclectic collection ... well worth the time! The facility is a collection of buildings connected by enclosed bridges, which makes it a bit interesting to find your way around, but you will find great art pieces as you explore.",couple
2016/10,5,Free Sunday,This is a great place to spend a few hours while you are visiting Brown University or Providence. It is walking distance from downtown. and you can have lunch on historical Benefit St. Best kept secret free admission on Sundays. See the museum and eat at Korean restaurant one block away Den Den. You will love it.,couple
2016/10,5,RISD Museum,Beautiful museum with the recently added Bolt coffee cafe blends contemporary with historic architecture for a great variety of art genres.,Family
2016/11,4,Incredibly Eclectic,"So many varied types of art and collections. There was something interesting at every turn. It would be helpful if there was actually a map of each floor, but this is a minor drawback to an otherwise fun and refreshing museum. If you have time to let yourself wander, you will get a lot out of enjoyment from this museum.",Friends
2016/11,5,Awesome Aesthetic - Compelling Collection,"You don't just visit the Rhode Island School of Design (RISD Museum), you allow it to envelop you. Stunning, diverse and cleverly curated. It is the quintessential university collection on steroids. The collections span ancient civilization in the east and west, contemporary and modern, paint to porcelain, silver to sculpture, architecture and design. It is a fusion of culture and aesthetic that invites your to drift through the concise but strong collection. One has to meander as the museum encompasses five cleverly interconnected buildings. From the creaking floors of a colonial federalist home to more traditional and modern galleries the setting compliments the collection. Perfect for a rainy day as you'll be occupied for hours - but not to be missed.",couple
2016/11,5,A Favorite small museum experience,"So many great works in the permanent collection. The period rooms are a treat for small ones. all staff welcoming and informed.
Not perfect for smallest amongst us but hey enjoyed the active booklet.",Family
2016/10,4,Nice eclectic collection,"The RISD Museum has different exhibitions and will interest many people.
The museum is easy to get lost in (different interconnecting buildings).
Staff is friendly and helpful.
It is worth checking out if there are student exhibitions, we visited one which was nice.",Friends
2016/10,5,A treat and a respite in downtown Providence,"Excellent museum, with a wide selection of art available for viewing and interacting. Be sure to find the fabric section--and to ask for assistance in having them open drawers and bring out items you might not expect. Frequent lectures available, terrific new coffee shop with food (Cafe Pearl). Never assume what will be there--expect the unexpected. A real treasure.",Friends
2016/06,4,"Creative, Thoughtful Museum","Have visited this museum many times for a wide variety of exhibits and film shows. Always innovative, exciting, varied, and pleasurable experience.",Friends
2016/11,5,nice and a must see!,place and very very nice,
2016/10,5,UNIQUE CLASSEY BEAUTIFUL ARTWORK,The designed items are one of a kind and amazing. The artwork includes many well known artists. A must see in Providence!.,couple
2016/10,4,"Don’t miss this gem!

","It would be a pity not to visit this smallish powerhouse of a museum if you are in Providence. While the museum is small compared to, say, the Metropolitan Museum of Art, it packs in quite a variety of artwork, from Ancient Egypt and Asia to current trends in art and design. The Impressionist area was being renovated, but many important impressionist paintings were downstairs in a special exhibit. Part of the museum’s charm is that it’s part traditional museum and part house. The main drawback is that there is no good map for the complicated, twisty layout. However, the docent “guards” are very helpful. The café is too small to handle the lunch crowd, even on a week day.",couple
2016/10,3,A labyrinth but probably worth it.,"Nifty current impressionist show, Manet, Monet, others and some nice context. You do wander quite a bit when you're there and it's hard to understand the floor maps--mostly you don't believe them--but theyre accurate. No handout upon entry to know where the various exhibits are. You'll be climbing some stairs at this museum. Very nice staff at entry who helped me with a locker and a storage spot for my suitcase--was on a business trip. Cute little gift shop, but with all they have to choose from, it's on the meager side. They, like all museums--why is this?--subscribe to the ""tiny description convention,"" which makes i difficult to read to informative panels by each of the works. So much for 'design' as an enabler of good communication. I'd go back depending on the show they're doing, but only then.",solo
2016/10,5,Tiny At Gallery,This is a small art gallery in comparison to some of the Major museums but it has quality. The museum is compact and delightful.,Friends
2016/10,4,"Small, but impressive","Their present show on ""Impressionism"" was worth the visit alone. But also don't miss their ancient artifacts.",couple
2016/10,4,Wonderful,"Around every corner, up every twisting staircase, up every elevator from floor 6 Egyptian, down to the Chace Plaza GS, you will find something surprising and enchanting. Loved the Nick Cave Sound Suit and the Chihuly glass work. The small but representative 'Inventing Impressionism' open as of 21 October took me back in time.",solo
2016/10,5,Start your Christmas shopping,Love the museum store. Always can find a special gift at risd. What a Rhode Island treasure to gave so much talent.,solo
2016/09,5,Great museum,"You won't be disappointed here. This is museum that perhaps is not well know, but worth every minute spent here. I particularly like the Egyptian items which I was first exposed to many decades ago.",couple
2016/09,5,Very nice museum,The best museum in Providence very good made and the collection is not so big but really interesting. Is a must when you are in Providence.,couple
2016/10,5,Full of unexpected gems,"There is something for everyone in this museum, from ancient Rome to Rothko, old and new. I recommend exploring the ""house"" part of the museum.",Friends
2016/09,5,"Amazing experience, beautiful museum and displays!","If you're an art lover in Providence, this is the place to be. I was left in awe with every artist displayed there! (Monet, Van Gogh, Picasso) and the curatorship was absolutely beautiful! They close at 5pm, and we got there an hour before so we didn't have time to see everything with patience. I will definitely be back to experience more of this beautiful museum!",Friends
