Date ,Rate ,Topic ,Review ,Type 2016/02,4,Wonderful Collection of Art,"This museum was much bigger and better than I expected. I went with my daughter who had to do an assignment for a college course expecting it to be RISD student art, which would have been fine. It is a large, very well laid out museum of art from many periods of time. There is modern art and very old art from Medieval times with art from periods in between. It also includes furniture, dishes, sculpture and decorated, furnished rooms from different periods in time. I especially enjoyed the small collection of Impressionist art, Jesse Burke photography exhibit, and the hall of paintings (mostly portraits). We spent about two hours going through the museum, taking our time. The parking lot (about two blocks away) pointed to on their website offers a discount to RISD Art Museum visitors during the week, but is a $6 flat rate on Saturdays.",Family
2016/01,5,Wonderfully laid out with great works of art.,We went to the Museum on a warmish January day. The paintings are laid out very well with some work done by well known and not well known artists. Every aspect of what would you see in a museum was there. The house attached gave two looks into history.,couple
2015/12,4,Not Just For Students,"I must take exception to the assumption made that this museum is for the students at RISD! The RI Art Association began its crusade to establish the Museum long before RISD was established as a school- and for a museum this size, it manages to display an amazingly rich and varied cross section of creative works.

The RISD Museum a fascinating and quirky place. The Pendleton House, which features beautiful period furniture and craftsmanship that rivals the Newport Mansions, is an actual house which was built in 1906 as a replica of the residence owned by Charles Pendleton. When I first began visiting the Museum it was a complete pain in the butt to figure out which staircase to use to get from one side of the Museum proper to the other, because this house sits right in the middle of the building! It is rumored that ghosts have been seen roaming the upper halls.

The museum’s Farago Wing has constantly changing shows that reflect the best in contemporary and cutting edge art. The new Chace Center has its own theatre and plays host to visiting artists and art films and the permanent collection, which features art from Asia, India, and the ancient world, contains one of the few true “charged” Buddhas in the Western world. This massive, serene statue sits quietly in its own shadowed room and every visitor is hypnotized by the palpable aura which surrounds the statue. I have seen it quiet throngs of screaming children within seconds.

In the summer, on the third Thursday of every month, the RISD Museum spills out onto the streets in true block party style, with events, music and excited crowds that throng until closing at 9pm.

My one regret is that the vast pre-Columbian collection which the Museum owns seldom makes it to the upper levels. I was astonished to discover that the visitor’s collection is only the tip of a giant iceberg of art which remains sleeping through the centuries in the basement archives.",
2015/03,4,Nice little art museum,"This museum is for the students at RISD, so it's got a wide selection but not a deep one. My favorite part was the small collection of Roman and Greek art.

It's a nice place to go for an hour or two.",Family
2016/01,5,Best medium size museum in East Coast USA!,"Large collections in Egyptian, Greco-Roman,Persian sculptures. impressionists paintings, Andy Wharol, Photograhy, Modern, Abstract and Contempary collections.
Middle of RISD and Brown University Campus on Benefit St. Providence RI 02906
Free admission on Sunday all day until 4 PM",solo
2015/12,5,Wonderful museum,"If you visit Providence, this museum is must see! It is not that big but has a few real art jems. It has a nice sample of all art forms and styles. Has a great new wing with modern art. Also Pendleton House is such a wonderful way of exibiting American Art. Definitely will visit it again!",
2015/12,5,Best things are kept in small packages,What a jewel! I remember stumbling upon this museum few years back and being amazed how much work class art is represented here. Sunday admissions are free and there is always real fun project going on.,Solo
2015/12,5,Terrific museum,"We have lived not too far away for a great many years and only finally have made it to the RISDI Museum. We thought it was just a museum of students' works, but it is a first rate art museum with many classic artists' works. We absolutely loved it.",
2015/12,4,Impressive and eclectic collection and a Beethoven Concert,Took a day trip from Boston to check out the collection. I was very impressed. The building is interesting with both modern and old sections. The art was varied with some beautiful pieces from a wide range of periods. It was free admission on Sunday. we were also treated to a Beethoven concert in the main hall of the museum. What an amazing find. Definitely a must visit when in New England.,Friends
2015/12,5,"Very nice collections, a bit of everything","This is a very nice and varied collection. Especially interesting egyptian and oriental works,as well as early American furnishings and art.
The huge carved wooden buddha shown in the picture is one of the most magical museum pieces! It fills an entire room. It is wonderful to just sit in the room with this statue and relax your body and mind... take him in.
The museum has special prices and programs throughout the year. They offer art classes for kids that are wonderful. I took both of my kids when they were young, for weekly classes, and we still have some of their creations at my house, many years later.
Located on ""college Hill"" where the RISD campus kind of melts into the Brown campus. There are beautiful historic homes and buildings in this neighborhood, and many great restaurants and little shops just up the hill, on Thayer St.
i have been there many times over the years, kids all grown up now, and one of them graduated from an art school :))

I wrote ""family with young children"" below, because I think its a great place to bring kids, though you need to expect that they behave appropriately, or leave, so as not to be disturbing others.",Family
2015/07,4,Impressive collection,I was impressed/surprised to see how well curated this museum is and the extent of their collection. I assumed it would be mostly student work and was very happy to find many of my favorite 20th C. Museum collected artists.,Solo
2015/03,5,World class collection,"“The RISD museum has a great permanent collection that can be viewed in one visit.
The Museum is small and intimate but with a breadth of art pieces and scholarship.
Rotating exhibits are usually interesting.”
",couple
2015/11,5,Lovely variety of exhibits,"The RISD museum offers a wide variety of different exhibits suitable to anyone's tastes, from the post-modern to the surreal to the classical. You'll find Monet just a floor above exhibits of drapes or ink splots or whatever it is the Bohemians are calling art these days. There's also a beautiful reconstruction of a classic Providence home - some of the furniture on display (both in the recreated home and outside of it) is absolutely singular, particularly the separate display of the late 19th century silver desk and chair set. There are also exhibits on older art and design, including the massive, ancient wooden Buddha statue. There's really just something for everyone's taste here, and it's absolutely worth a visit - even if you think that post-modern art and abstract art is utter rubbish.",
2015/11,5,"Histyoric School, fabuloius setting","Beautiful campus and creative use and purchase of old neighborhood buildings to repurpose for the College. Great academics, impressive museum with close walking proximity to town.",
2015/11,5,Great Part of PVD Weekend,I came from Boston for the Martin Boyce show. RISD Museum is a great part of a weekend getaway from Boston. So close to hotels and superior PVD restaurants and bars.,
2015/10,5,Great Little Museum,"A huge range from 600 BC artifacts to Frank Stella, but it all works and doesn't feel scattered. A lot of really interesting stuff and a great old+new building.",Solo
2015/11,5,Don't Miss it,"Best museum anywhere, in my opinion. You get everything here. Not just one style, but many. Many classic originals from the greatest artists ever, as well as contemporary art and even Egyptian artifacts. And, their exhibits are changed out regularly, so going back in a year to experience the next displays !",couple
2015/10,5,Stunning!,"The RISD Museum is extraordinary in every way. The architecture, the various collections, the special exhibits. A perfect example of the delights of a small but first class art museum. Added bonus: the gift shop is stocked exclusively with art, jewelry, textiles, books, designs, tools, children's toys, ceramics, etc. etc. by people directly connected with RISD. Truly original!",Friends
2015/10,5,Lovely collection,"With just a two hours, I decided to visit on a recent trip, I was so delighted with what I found! A small but very good collection from a wide range of periods, beautifully arranged and displayed. The layout of the museum is a little confusing but the staff is very helpful.",solo
2015/10,5,A must-see small museum.,"Dedicated to the art of America and the art that has impacted Americans, the collection is compact, but powerful. Serious quality in all areas is impressive for a smaller institution. A historical house with first-rate period rooms, world art from multiple cultures, and decorative arts of many periods are a backdrop for work by students, faculty, and visiting contemporary artists",Solo
2015/10,4,quick outing,Layout was kind of confusing. The student artwork exhibit was under construction and unavailable for viewing.,couple
2015/05,5,RISD Museum a winner all the way,"Always interesting and have special exhibits all the time. Form priceless collectables to Egyptions Mummies, well worth the trip.",
2015/10,5,Incredible museum,"We were so impressed with the quality and diversity of the collections. Most of the French Impressionists were represented such as Monet, Renoir, Degas, and Manet. There were several Warhol paintings and a unique Warhol cow wallpaper tucked away.
It was interesting to see period furniture rooms.
There was a lion embedded into a wall from Babylon. Don't miss the Hadrian tablet.
There is truly something for everyone such as a Rathko for the people interested in contemporary art.
Chihuly graduated from RISD and has a chandelier here.
This museum is a true gem!",
2015/10,5,"Great, free Sunday afternoon in Providence!","While not a huge museum on the order of those in New York or Boston, the RISD museum does have a wide range of items, from ancient Egyptian and Greek items to Hockney and Rothko. There is a a room devoted to design and a Federal-era ""house."" The only down check is that the Grand Gallery with paintings from floor to ceiling has a legend only on one iPad in the corner. (In the past there were laminated sheets that at least told you subject and painter.) But, as a whole, the museum is worth a trip--and particularly on Sundays when admission is free.",Friends
2015/10,5,Great museum,"Highly recommend, pretty amazing collection for a small university collection, the first floor is a bit off putting, persevere, you will be happy.",Family
2015/10,5,A concentrate of the history of Arts!,"Amazing small museum concentrating the entire history of Arts and Design! On top of permanent collections, there are always interesting temporary exhibitions of guest artists and talented RISD studentsM",Family
2015/03,4,Enjoyable small museum,"Set in adjoining buildings of various types, this small museum has surprised us over three visits with substantial pleasures of many sorts - antique furniture and silver, modern design in both temporary and regular exhibits, select fine art from many places and eras. The hard-to-figure-out layout of the museum seems part of its charms; it makes good sense that it's part of RISD, a top US design school.",couple
2015/10,5,Both internationally famous and local art,"Interesting selection of ancient (Egyptian, Greek, Roman, Japanese, Indian) and modern/contemporary (Picasso, Warhol, Liechtenstein, Frank Lloyd Wright) art along with student works from the graduating year and 18th-19th century American plus 17th-18th century European (including a Dürer). Mixture of sculpture, furniture, painting, photography and sketches. Easily accessed from Benefit Street or North Main Street. Very quiet when we were there.",
2015/10,5,Surprise Museum in Providence,"Gigantic room filled with 12th century European art. We sat there for over an hour enjoying the beauty and works of the many master artists.

Another surprise was ""The Hand of God"" by Rodin. Awesome.

Visited Saturday October 10 for free too.",couple
2015/10,5,Providence :),"I didn't expect anything at all. But after the visit, I was jealous of RISD students for a great campus :)",
2015/09,5,This museum has a little of Everything.,"This museum was a surprise with showcasing Modern furniture to Contemporary paintings, Egyptian displays to Ancient Greek and Roman pieces. You can find examples of 18th century American art to Picasso and Monet in the European Grand Gallery. It is small, with stairs and elevators between floors, but it was never boring in composition. The gardens were closed for renovations but we were able to see most everything else. It was free on the Sunday we went.

The food selection was very small and premade. You could find it in the gift shop which was very nice.",couple
2015/10,5,Art Fair,"Wonderful to see students, teachers, artists alike showcasing their art, work and willing to spend the time chatting about their ideas and challenges of artistry. Ones thing though, the asking prices are outrageous.",couple
2015/10,5,One of the best design museums in the world!,"The RISD Museum of art is high on my list of best design museums in the world. Serendipitously, we arrived during the annual RISD alumni fall art sale. As it's origin was based on the education and production of industrial art, there is a great selection of decorative arts and textile pieces. There is also a wonderful collection of work from contemporary artists, such as Lichtenstein and Warhol.",couple
2015/09,4,"Small, manageable size museum",We enjoyed visiting this museum. It is quite small which was perfect for a short visit. It has a nice collection of a variety of things.,solo
2015/10,4,Great combination of student and professional art.,"A terrific museum. I was expecting mostly student art, but the collection includes an excellent sample of various eras, artists, and styles from around the world",Family
2015/07,5,RISD Museum is a must!,This was an amazing experience. Some collections boasted artists and students who were or currently are students at the RISD. You can dedicate an entire day to the museum. It has a costume and fabrics collection that was very interactive which we immensely apprecoated.,
2015/04,5,"Nice Collection of Ancient, Classic and Contemporary art.","Rhode Island School Of Design is such an amazing creative place. The museum is a really nice collection of ancient, classic, and contemporary art.",Family
2015/09,5,Impressive & Varied,This museum has so much variety in artists & eras. Thoroughly enjoyed my visit. This is a gem in the heart of Providence.,Solo
2015/09,5,great pieces,Many beautiful and important pieces. Its a great place and a must do to do when in town. Check out the student's exhibitions downstairs.,couple
2015/09,5,Bigger than expected,"This is a full-blown art museum with something for everyone. I didn't expect such large, detailed collections for every aspect of art. A must see!",Friends
2015/09,4,Good Smaller Museum,"The museum has a variety of art, including contemporary, Asian, 18th-19th century European, plus some student work, some of which was very good. But the map/guide is hard to use; it doesn't show a floor plan, as most museum guides do. Instead it shows a side view, listing what is on each floor. So it was a little hard to navigate around. Also, in the large gallery with many European paintings, there is one Ipad which can't be moved, so it was hard to find out what each painting was. It would be much better if they had plastic sheets that you could pick up",Solo
2015/06,5,Hidden Gem,"This amazing museum is much larger than it looks from the outside with a wide variety of attractions. Personally, I adore the antiquities from Rome which were just spectacular to view so closely. The paintings, outfits/textiles, furniture, coin collections and jewelry were memorizing. I can't wait to go back!",Friends
2015/08,4,Wonderful Impressionist collection,"This is a lovely museum, connected into several buildings which makes for a slightly confusing tour. But also gives it a character that's unique. An excellent collection of fine as well as impressionists and modern art. Enjoyed the experience.",Couple
2015/09,4,Hidden gem,"We didn't know what to expect when we visited the RISD museum and were very pleasantly surprised at this gem. It had a little bit of everything you're looking for in an art museum, the building itself has its own history; interesting design pieces as different as a chair or wallpaper; modern paintings, old master paintings, sculptures both old and new, and terrific workwork. The museum store sells objects designed by school alumni. A great place to spend an afternoon.",Friends
2015/09,5,Fantastic!,"This was my first trip to Providence so I had no idea that RISD had a museum or that it had such a great collection. They seem to have a nice sampling of lots of things I really like. The staff there is super friendly and the museum store is filled with work of RISD graduates. And, bonus, free on Sundays. We arrived at opening (10 a.m.) and had a very relaxed, not crowded visit. I plan to return the next time I'm in town!",
2015/09,5,Nice collection,The RISD museum has a good collection of art from across time and continent. It is easily seen in 2-3 hours.,couple
2015/09,4,A nice small museum,"I enjoyed the RISD museum of art. I made sure to stop by the student exhibits because I wanted to see what the artists of tomorrow were formulating. Some stuff was out there, not necesarily my cup of tea but some were very well composed and seemingly effortless, coming from the soul instead of the hands of the artists.

My favorite sections were the impressionists, the contemporary and the 3D sculptures/designs. Warhol, Renoir, Monet and my favorites, Van Gogh and Degas, were on display. The porcelain display was also new to me and captured my interest. I'm used to the blue Delft type of ceramics but these displays had very delicate figurines of people and animals, in a variety of poses. The Pendleton house gave a glimpse into early 20th century living, nicely maintained if this interests you.

Overall a nice museum but shouldn't be a primary reason to come to Providence.

And I fully agree that money does buy happiness, because ""Happiness Is Expensive"" - Alejandro Diaz, neon lights installation. Ignorance is the other avenue to the illusion of Happiness.",
2015/08,5,RISDE,"This is a fabulous campus-beautiful in every sense!. The RISDE permanent collection is ENTIRELY worth a trip to Rhode Island. It is entirely a gem. After the museum, go to tje bookstore, and then you should walk down Benefit Street- beautiful historical homes etc. Could not find any trash in RI- a very clean city. Eat at Heminways- great seafood!!.",Friends
2015/09,4,A gem,"If you are visiting PVD and you appreciate art, a stop at the RISD museum is a must. For a small museum it has a good collection of American artists as well as international. The old part of the museum is an architectural beauty in itself.",couple
2015/09,5,My favorite art museum,"We've visited RISD twice and have been very pleased both times. This museum benefits from not being overwhelming in size but still has a nice variety of excellent displays. There are student works presented and works of the Masters as well. I love the blue room with dozens of oil paintings covering the walls.

There's a cafe and gift shop within the building. We stopped midway through our visit for a drink and a snack, which prevented tour fatigue.

The building is well prepared for wheelchair visitors. We had no problem seeing all of the exhibits.",couple
2015/08,5,Great place to spend the afternoon.,"There is a lot to this museum. Some ancient artifacts, some modern art, some reconstructions of living quarters. There is a lot to see and do in this museum. It is located on Providence's East Side In the heart of the Brown University campus, it is definitely worth checking out!",Friends
2015/09,5,Best part of RISD,This place was voted the best museum associated with a school. We are fortunate to have a child as a student here and are able to view the facilities. A must see.,Family
2015/08,5,An Art History Lesson in 1.5 Hrs,"This small museum has shocking breadth. Take advantage of any guides or tours available, and enjoy a walk through a very impressive collection.",solo
2015/08,5,A great museum to take a family with an introduction to many ranges of art.,"The museum offers a great introduction for kids to the world of art museums while offering adults an opportunity to see many pieces in a compact setting. The museum offered the opportunity to see Egyptian, Greek, Roman, Asian, European masters, American and many contemporary pieces. The wide range with manageable size and scope was a nice introduction for kids. I feel the Art Institute in Chicago, LACMA in Los Angeles and Museum of Fine Art in Boston are all amazing facilities and so worth a visit but the challenge is doing it with younger children. The RISD gives you the opportunity to focus without room after room and show them what a Picasso or Monet or ancient pieces look like. The kids really enjoyed thinking about seeing Greek and Egyptian pieces that went back thousand of years. Free on Sundays which is great. The Benefit Street Entrance toward the back had ample free street parking for 2 or 3 hours depending on how far you would like to walk. Close to Brown University too for a quick tour through the campus. Very Nice!",Family
2015/08,4,Small but high quality museum,"This Museum offers a wide range of Art works.
The American decorative Arts,Asian Art and European paintings are some of the highlights.
Only drawback is the quirky layout of the galleries as the Museums straddles several buildings.",couple
2015/07,4,A Little Something for Everyone,"The RISD Museum is a great place to go to see a bit of art, ruminate over old and new items and get a touch of Rhode Island history as well. It has a lot of variety for a small museum and its well thought out enough that you can experience the variety with every turn you make walking through. Going into the Pendleton House section is like stepping into a Rhode Island time warp. Worth the visit...",Solo
2015/08,5,Beyond expectations,My wife and i had a couple of hours to kill in Providence and decided to give this little museum a try: WOW. For such a small place they pack it all in. To really enjoy it all make sure to give yourself at least three hours.,couple
2015/08,4,RiSD Museum Worth a Visit,Very glad that I visited. Diverse collection. The Etruscan collection and the textiles were wonderful.,solo
2015/08,5,"Fabulous, and free on Sundays","We really enjoyed the RISD Museum - huge variety of art, sculpture, etc and from many periods and cultures. Everything from a huge stone Buddha, to Egyptian mummies to Impressionist paintings - something for everyone......and, much to our delight, no charge on a Sunday.",Family
2015/08,5,RISD Museum - Wonderful,Wonderful small and manageable museum packed into six floors. Was amazed at the diversity of the collection and impeccable condition of the building. Lady in the gift shop was most helpful. Truly enjoyed the visit.,Friends
2015/08,5,Always a delight,We have visited this museum several times and have always found something new and delightful each time. Our recent visit with a friend enabled us to see the Museum through her experience. The wonderful variety of artistic expression as well as the masterful combination of a stately mansion with a sensitive addition will keep the visitor coing back time and time again.,Friends
2015/08,5,Great museum with a lot of variety!,Great museum with a wonderful collection of Impressionist art. Not to be missed if you visit Providence!,couple
2015/08,4,Nice surprise,"This is a little known museum which houses several masterpieces as well as modern and contemporary art. Accessible and not expensive, well worth it",
2015/08,5,"Wonderful art, well displayed and lit.","This is simply an outstanding museum. It has a great collection of art from most all periods. The art is very well displayed and lit. Pictures are allowed, no flash, and seldom do you get a bad reflection. The art is very accessible. We loved the buildings as well. Do get one of the guides as the 5 houses are well connected, but you could easily miss something without the guide. And allow enough time. We took several hours, and I could have easily spent a day if I were to have sat in each room that I wanted to.",Friends
