Date ,Rate ,Topic ,Review ,Type 
2019/08,5,Worth every minute,"Fine museum with something for everyone of every age! Wonderful paintings both contemporary and traditional, a huge carved buddah, a mummy and sarcophogus, Japanese swords, and too many more wonderful things to mention. Do not miss!",
2019/11,5,A hidden gem,"RISD Museum of Art was bigger than I expected. The Gorham exhibit was fascinating and informative. The ""Raid the Icebox 2"" exhibits were terrific. A re-do from 50 years ago when RISD invited Andy Warhol to raid the icebox (storage) and create an exhibit, this year RISD invited 10 current artists to do the same. So fun to see the unique ways to show the artwork.",
2019/11,4,Nice to visit on a rainy Sunday,"It is a very small museum, but the best parts are the Pendleton House and the Gorham Silverware exhibit.",
2019/11,5,A Quality Art Museum In Historic Providence,"Recently,I returned to Providence and the delighful RIsd Art Museum.I devoted my day to studying its quality European paintings and sculpture.I did not see everything in this art museum that has a broad range of Art.Old Master personal favorites were Spinello Aretino's""Saint Anthony Abbott Enthroned"",Jacopo di Cione's""Taking of Saint Peter"",Giusseppe Cesari's""Perseus and Andromeda"".Aert de Gelder's""Esther and Mordecai"",Francisco Collantes'""Hagar and Ishmael"".Marinus Van Reymerswaele's""Money Changers"",and Giovanni Pannini's""Colliseum"".19th Century favorites were Jean Victor Bertin's""Tivoli"",Edouard Manet's""Repose"",Claude Monet's""Bassin At Argentieul""(awesome French Impressionism),Carolus Duran's""Portrait of Manet"",and Edgard Degas'""La Savoissiene"".I also savored the fine Gothic and Renaissance Period sculptural works that were on display such as Ivory Diptych from 13th Century France depicting Nativity and Crucifixion,and Tillman Riemenschneider's ""Pieta"",among others..Kudos to a fine art museum in historic Providence.",
2019/11,5,,"We had 1 day in Providence. The RISD Museum was on our Must-Do list and it did not disappoint!

Varied types of exhibits for all to enjoy & the current Gorham collection. Our young children enjoyed the museum as well - they wanted to sit and sketch like a number of other museum guests on the 3rd floor by the Modern and Contemporary art.

We visited on a Thursday AM and paid for parking in a local lot. We did our homework regarding visitors fees, lockers, personal bag size requirements. Musuem was easy to navigate. We enjoyed the Cafe Pearl for a coffee and snack. Very friendly staff all throughout the museum. We are glad we visited - RISD Museum was on our bucket list.",
2019/11,4,"Eclectic collection, something for everyone","RISD Museum is fairly small so can be tackled easily in a couple of hours. It houses a very eclectic collection, from ancient Egyptian mummies to the most avant garde works of today. Enjoyable and fairly admirable museum, especially for a less than huge city.",couple
2019/10,4,Beautiful small city and museum,"For a small museum it has world class pieces from contemporary, impressionist and renaissance pieces. The Gorham silver exhibit was extensive and fascinating.",
2019/10,5,surprising and rich also with for kids,"interesting collections and beautiful spaces, we spent a couple of hours and did not manages to tour the entire museum. The variety is such that also a 10y old can find something to enjoy!",
2018/11,5,An Amazing Destination for Art Lovers,"As a RISD alum, I'm naturally biased, but the Museum of Art at the Rhode Island School of Design is an amazing destination for a day trip in southern New England. Paintings, prints, sculpture that runs the gamut of artistic syles can be found right here in Providence, Rhode Island. Why not check it out?!",
2019/09,5,Eclectic Things to Enjoy,"RISD offers art, theater and music - from modern and classical. I've enjoyed everything from modern dance, ethnic music, famous antique silverware, movies, student and professional artworks, etc. Everything has been high quality, free and open to the public.",
2019/09,5,Wow! Must See!,"I was blown away by the RISD. Great contemporary art from the Classics -Picasso, Rodin sculptor, Chihuly (alum) to the wonderful and insightful student art work. So much to see!",Friends
2019/09,4,Excellent collection,"An excellent collection well worth the visit. Spread out on six floors, starting on the third floor in a staggered way... the docents were very helpful in finding your way. The museum is seemingly constructed in different buildings and as you move through the space, it's a bit of a wayfinding 3D puzzle. Maps were very helpful. And the collections, especially in the impressionism was, very impressive. The special exhibit of Gorham Silver was very nicely curated -- thank you.",
2019/09,4,Interesting collection,The museum is a sprawling collection of interconnected buildings including the reproduction of the Pendleton House. The Gorham silver exhibit was especially interesting.,couple
2019/09,5,Very Fine and diverse collection,"We came to see the Gotham Silver show , which was great, and stayed for the great furniture, paintings, decorative art and fashion. Definitely worth the trip. ",couple
2019/09,5,Not to be missed in Providence,"This museum is a small gem associated with the Rhode ISLAND SCHOOL OF DESIGN and located near Brown University. It has an excellent eclectic collection of fine arts, glassware, pottery, clothing, impressionist paintings and modern arts, textiles, graphic arts, etc. Exhibits are well presented with good lighting and visible explanations. Special exhibits are offered regularly. There is a gift shop and a small cafe. The current Gorham silver exhibition is of special interest in Rhode Island as the company was founded here. Part of the exhibit is a workbench with videos showing the evolution,design and production of selected silver items. Guards are friendly and helpful. The museum is free to the public on Sundays, otherwise there is a $15.00 admission fee with student , child and senior discounts. Do not miss!",
2019/09,5,THE HEART OF PROVIDENCE,"Back in the 90s, I worked as a security officer for RISD,, it made fell like I was going to college, because Brown University is right next to it,, Providence, Superior Court system is there, down town Providence is a walk a way , RISD is located int he historical side of Providece,,therr's a lot of history, plenty places to eat an drink, many hotels like the Hyatt, The Biltmore and others PPAC providence performance art center is a place to visit. and many other acttractions. I live a 1/4 of a mile from RISD",
2019/08,5,A Very Comprehensive collection,"I was pleasantly surprised by the breadth and scope of the museum collection. The current Gorham silver collection was the highlight of my recent visit. The museum houses a broad range of collections, from European to Asian to ancient works. A great experience overall!",
2019/07,5,Fascinating Collection: A Must See When in Providence,The Gorham exhibit currently on display at the RISD Museum is superb. Beautifully presented and described. The ecclectic collection is great fun to see and the rabbit-warren design adds to the delightful elements of this seemingly small but encompassing Museum.,
2018/12,5,Very interesting,"For the art lover and general public, very educative exhibit. Worthwhile the visit. Easy walk from the train station in downtown Providenc",
2019/07,5,Worth a trip,"This is an amazing small museum. The works include some of the most famous artists. All of the works are first rate. It has paintings, sculpture and decorative arts from ancient mediterranean to modern. It's worth going out of your way to go to Providence to see the museum. We stayed in a nearby hotel so we could walk over, see the museum, go to a late lunch and then retire to our hotel",
2019/07,5,Lots of interesting art,"Lots of variety of forms of art, so it appeals to everybody. The price was reasonable and it was fun to wander thru varied exhibits. Nice place to spend a hot day.", couple
2019/07,5,A Hidden Gem with an Outstanding Collection of Various Types of Art,"My husband and I visited the RISD Museum in Providence, Rhode Island on Sunday, July 14, 2019. This is an excellent museum with all galleries well laid-out and nicely curated with an outstanding collection of various types of art. All the write-ups throughout the museum were quite educational and interesting addressing cultural, historical, political, social and religious aspects of the art, depending upon what was applicable. The special exhibit on Gorham Silver was exquisite and definitely worth seeing. This museum is definitely a hidden gem!! Our visit to the museum took about two hours, based on the amount of time available to us, but it could easily have taken well over 3 hours to be able to absorb and appreciate all the artwork on display. We definitely needed a map to get around the museum because of the way all the galleries are connected throughout multiple floors and buildings. The only real drawback to this museum is parking. Fortunately, we were able to find a space on Benefit Street, a convenient walk to the museum. However, finding a space may not have been easy if school was in session. We really liked the 18th and 19th Century American exhibits, especially related to the Pendleton House rooms. These included the rooms with the titles: ‘The China Trade Room’, ‘The Well-Furnished Farmhouse in Providence’, ‘Two Generations of Rhode Island Cabinetmakers’, ‘Cabinetmaking in Newport’, ‘Gambling Collectors - Tea Pots’, and ‘The Charles Pendleton’s Library’. All the furnishings in these rooms were very impressive. Even the curtains were beautiful. Touring these rooms was like a walk back through time. The Ancient Greek and Roman exhibits were nicely arranged with many objects, such as, bronze, metals, Roman Jewelry and coffins, coins, sculptures, Greek Funerary, figures from different cultures and vases, vessels and flasks for the Greek Gods and Goddesses and much more. All the objects displayed in these galleries were well preserved. The European Art featured very impressive paintings by many masters under multiple classifications such as ‘Painting Modern Life’ with Impressionists using new techniques in their brushstrokes, ‘Painting Landscapes’ with a heightened regard for nature and ‘Abstracting Modern Life’. All these paintings were beautiful. There was Religious Art from the 1300s with emphasis on Material and Meaning. Also in the 1300s there was an ‘Unearthing of the Past’ where the ancient pasts of Greece and Rome were rediscovered by European artists and there was a cultural, movement called Humanism during the Renaissance era, encouraging curiosity about nature, the world and individual expression, which was very interesting. In addition, the artwork within this gallery addressed ‘Trade Across Cultures’, ‘Venice and the Marketplace’, and ‘Imperialism and Production (1686 – 1851)’ where there was an exchange of techniques and materials. There was also a section/gallery on the different aspects of the ‘Artist’s Profession’ as it related to European art in the early 1800s. The Art of Ancient Egypt – from 5,000 years ago emphasized the funerary traditions with a rather impressive mummy on display. The art was for a functional or ritual purpose and words and pictures were combined to convey a unique meaning as depicted in the ‘Understanding of Egyptian Objects’ display, which addressed the interesting principle of mixed perspective among other aspects of this art. The Asian Art included very nice Japanese emerald and clay, devotional and funerary objects, including Budha and a gallery representing insects with ‘A chorus of Chirps, Hums and Buzz’. The Costume and Textile and Quilt Galleries were impressive as well as the Modern and Contemporary art, including very elegant and unique clothing and furniture.The Print Making – Visions and Revisions was quite educational with displays regarding ‘Aquatint and Goya’, ‘Etching and Rembrandt’, and Mezzotint Engraving. The write-ups for these displays addressed the processes involved with these techniques in art and were definitely quite educational. Special Exhibit: ‘’Gorham Silver – Designing Brilliance 1850 – 1970’: This exhibit addressed the many aspects of Gorham Silver and illuminates the heights of Gorham’s industry, ambition, artistry, technology, creativity and innovation. The history of the founding of Gorham was addressed with its beginnings in a small workshop to its significant growth as depicted in the display ‘Gorham Silver and American Industrialization’. Through machinery and equipment, the company had sufficient size and power to handle silver as though it was putty. with something for everything. The Classical Design and Source Materials were addressed as well as the Gorham Workbench which displayed the processes and tools used to create Gorham silver. ‘Design Inspirations and Influences’ were depicted with the ‘Restless Laboratory’ where the silver went from a Classical to Japanese Design with the American Aesthetic Movement and the desire to fulfill social aspirations. ‘Creating Gorham Silver’ illustrated the most perfect system with an effective network of organizational practices and a well-managed inventive approach. The ‘World of Styles in Providence’ were also on display. This was a very impressive and well done exhibit with many pieces of exquisite silver on display within it, definitely worth seeing. We recommend a visit to this museum and hope that you have the opportunity to enjoy it as much as we did. It has a real lot to offer, much more than what I mention here!!.",
2019/07,3,Gorham silver exhibit,Interesting history and craftsman detail of Gorham silver. Display was nice but not overly impressive. If you have visited stately homes ( Europe ) you may find it lacking. $15.00 for 2 rooms?,
2019/05,5,A Little Gem!,"RISD is a little gem of a museum. Holding a general collection, in less than an hour you can get a very satisfying aesthetic experience. And in two hours you can get an excellent, quick survey of art history. What makes a visit so perfect is the careful curation, thoughtful installations and intelligent labels. I chose to spend time in the special exhibition of Gorham silver and the Contemporary and European of 18/19th century floors. For me, the silver was a revelation. I had no idea Gorham made such pieces of upscale elegance and ambition. Founded in Providence, Gorham became the largest silver company in the world. And RISD has fabulous holdings. The high-end pieces showcased in this exhibition would have made any Newport dinner party guest envious. Elsewhere I found an excellent example of making a meaningful teaching point with limited objects in a display case of medieval/early renaissance art that combined carved ivory, portraits and illuminated manuscripts. But if I could only go back to see one piece--the one I would run out with in case of fire—it would be Manet’s portrait of the American artist Berthe Morisot titled “Repose.” It’s what the Michelin guide would call “worth a journey.” Visiting tips: The museum is housed on several levels of two buildings, which can be a little confusing for a first visit. So be sure to get a map and don’t hesitate to ask the staff for directions. The collections are open until 9:00 pm on third Thursdays. Tickets are $12 for seniors, $15 for adults. The gift shop is worth a glance and the garden well worth a stopping point.",Solo
2019/07,5,Delightful,Had a wonderful time here. A great variety of works. The Gorham silver-smithing exhibit was a great surprise. Very much enjoyed the impressionist rooms with Monets and Cezannes.,couple
2019/07,4,RSDI,"Fantastic! Nice ""sampler"" of art from the ancients to modern, with a design oriented twist. Rodin's hand of god was my personal favorite",
2019/06,5,Gorham Silver Display,Enjoyed the special showing and stories of Gorham Silver. Enjoyed seeing clothes by Coco Channel. Staff very helpful and kind.,Friends
2019/06,5,A wonderful collection,"If you are in Providence this is a must see. IT is an eclectic collection but worth the trip, works of are are well explained and staff great.",Solo
2019/06,5,Wow!,"If art is your thing, this place is amazing. There is a lot of Egyptian, Asian, and European art. It is spectacular. We spent several hours here and still didn’t see everything.",
2019/05,5,"Small on size, big on offerings: RISD!","Adult family spent a day in Providence, including a visit to the ""M-word"" (museum). We arrived after a late lunch and were literally the last ones to leave, such was our penchant for loitering amongst beautiful, historical items fabricated for love and money. We loved it!",Friends
2019/06,4,Nice little museum,"Although a museum of design, it covers quite a range within that remit. When I was there, they had a special silver exhibition which included some interesting pieces, especially a rather witty ice bowl and a cubist tea set. The main collection features some major artists such as Rodin, Picasso, Pollock, Monet, Van Gogh and Renoir. There are also works by less well known artists and lots of pieces from ancient times.",Solo
2019/05,4,"Not What I Expected, but Very Nice","As an artist myself, I've heard *so much* about RISD and its museum. I was expecting to see more contemporary, abstract paintings, but that's not really what you'll find here. Instead we saw a huge, super cool Buddha - loved it. We also enjoyed the Gorham exhibition (well, I did, not sure about my husband). My favorite part was probably the floor with the Van Goghs. Normally you have to fight and push your way to get up close with a VVG, but we had the space all to ourselves - quite nice :) It's a small museum with a little bit of everything. You can easily cover it in 1-2 hours.",
2019/05,4,"Not What I Expected, but Very Nice","From Egyptian mummies to paintings and sculptures by Old Masters to American furniture to a top silver collection to textiles, this museum has something for every interest and is worth visiting. Small in size compared to the large museums, the RISD Museum is sophisticated and offers enough for multiple visits.",Friends
2019/06,4,If you have time visit!,"The museum was great and the exhibits were a very good cross section of art and other displays. It was very well organized and the stuff were very helpful as they enforce the security of the museum. The good news, there was no charge to the museum on that Sunday afternoon.",Friends
2019/05,4,Gorham exhibition is a must,"After a private lecture on the exhibit we spent about an hour marveling at the craftsmanship of the silver on exhibit and the history of the brand. The museum is clean, well lit, very accessible and a must visit.",couple
2019/06,5,Wonderful contemporary design displays,"The RISD museum contains a carefully curated wide-ranging display of historic and contemporary arts and design exhibits. I particularly enjoyed the contemporary displays by predominantly local artists and RISD graduates. The European, Asian and Egyptian displays are small but well done. The historical American parlour displays are well worth seeing too, arranged as they are to reproduce historical dwelling interiors.",Solo
2019/05,5,Great experience,"Must see collections, which include great European impressionists, Picasso, Van Gohg. Free admission on Sundays.",
2019/05,5,Memorial Weekend Optional,about RISD Museum and the visit lived up to every expectation. Both interesting and entertaining- my husband loved it and so did my 17 year old son. A great family outing! Highly recommended.,Family
2019/05,5,A real Gem,"We've been to museums all over the world. This one has a little of everything that can work with your pace. The building is well designed and the staff (including security guards) are extremely courteous, kind and knowledgeable. We were lucky to be here on the first Sunday of the month so we got in for free. We checked out the entire museum in 2.5 hours. The RISD M of Art is located conveniently in downtown area, and you can access it by walking if you are staying in the area. The students are so lucky to have this collection of works to be learn and develop their understanding of art related works and also of cultures. I wish I had this when I attended college. Hope you enjoy it as well.",Couple 
2019/05,5,Don’t miss,RISD Museum is worthy of a visit. Very nice exhibits on several floors. Interesting gift shop. Thursday evenings are free!,couple
2019/05,4,Nice ... very small. Budget an hour.,The museum is very fun and very small. We had no idea what the exhibit was - turned out to be Gorham silver - 1850-1970. It was interesting. We enjoyed a lot of the interactive student work on the second floor. This was a perfect for us to spend an hour while waiting for our car to charge. Don’t forget to exit through the gift shop.,
2019/05,5,Go! Go! Go!,"Pick an artist of note, and RISD will have them. Pick a period or a type of medium, it's here. Great masters, modern art, marble frome rome, textiles, weapons, tea pots, a whole revolutionary period house, 20 foot tall wooden buda, mummy....getting the picture?
Cafe, gift shop, on street free parking, fully handicap accessible, it will take a minimum of an hour if you fly through, 2ish is normally how long it takes.",Family 
2019/05,5,Gorham exhibit,When my wife said she’d like to see the exhibit on Gorham silver I was a little dubious. But it was really interesting to see the fantastic work done by this RI institution. Little hard to get to given the building renovation but worth the effort,couple
2019/05,5,Amazing collection,"Absolute treasure of a museum with fabulous examples of Barbizon landscapes, Impressionism, and decorative arts and design. The current exhibition on Gorham silver is an absolute must see.",business
2019/04,5,World class museum,I visited on a Sunday afternoon (free admission) and was impressed with their diverse collection of art from ancient Egyptian artefacts to contemporary works of art from all over the globe. I ran out of time to see as much (as thoroughly) as I would have liked. Thanks would definitely go back; it’s such an incredible resource for a fairly small city but a true jewel !,Solo
2019/03,5,Amazing quality of art for size of museum,"We were lucky enough to arrive in Providence on the third Thursday evening of the month...when the RSID museum is free. So, without a concrete plan for the evening, we decided to puruse the museum before we went to dinner. Wow! What a wonderful museum. The museum is packed with treasures ranging from Byzantine art to Impressionists to British print works. We were only drawn away by the rumbling of our stomachs. The museum is very well curated and well worth a visit...especially if you are lucky enough to be there for a free Thursday night.",Family
2019/01,5,"Beautiful museum, they even have a mummy.",This is a treasure of a museum. You can find pretty much every style of artform within. The staff is Friends and you can easily take it all in within a couple of hours. You will leave feeling quite cultured and full of joy from all the beauty you've taken in.,Friends
2019/03,5,Surprisingly Great,"To be honest I went in with low expectations since we have some of the best art museums in the world in NYC. However, I was pleasantly surprised with the size of the museum and the collection. My students and I enjoyed the ancient artifacts. The number of world renowned painters they had on display was amazing. We didn’t know there was an old house attached which was fantastic. The student stuff we barely looked at. They even had a wheelchair for one of my students free of charge. We needed about 1.5 hours to see it all. I would definitely go back.",Business
2019/03,5,Ancient Greek and Roman Room is my Happy Place,My partner and I decided to take a few days to stay in Rhode Island. One of the things we wanted to make sure we caught was this museum. The Bona Drag temporary exhibit and the Greek and Roman room were on the top of my list and they didn't disappoint. I would recommend this to anyone,couple
2019/03,5,Pleasant afternoon,"Easy access, pleasant atmosphere, many students also in the gallery which added to the joy of visiting the museum.",
2019/03,4,most enjoyable,"Following a delightful Saturday lunch nearby, our daughter, her husband (both RISD alums) and their two children, ages 6 and 9mos. toured the museum for a couple of hours. Our grandson was hoping for some dinosaur fossils but was not unhappy about there being none, and enjoyed viewing the statuary and many works of art. We were somewhat disappointed that the contemporary art gallery floor was being renovated and not available for visiting, but not unhappy about all that we were able to view and appreciate. All in all, it was most enjoyable for all.",Family
2019/03,4,"A bit light on design, but a much broader collection than expected","We were expecting a museum focused on design, but saw that in fact, the design displays in this museum are only a small fraction of the collection. There is an antique home that has been incorporated into the museum, and there are Asian, Greek and Egyptian components, among others. The collection was much larger and more diverse than we expected!",couple
2019/03,4,More than we expected,Our visit was totally worthwhile. The museum and collection were much bigger than we expected. Very nice. Definitely glad we took the time to do this.,couple
